{
  "v": "1.0-EXPERIMENTAL",
  "stores": {
    "select": [
      {
        "key": "type",
        "op": "=",
        "value": "app"
      }
    ]
  },
  "window": {
    "axis": "write"
  },
  "match": {
    "granularity": "chunks",
    "all": [
      {
        "has": "req-8f3a"
      }
    ]
  },
  "max": {
    "chunks": 20
  },
  "response_format": {
    "kind": "chunks"
  }
}
